{
  "authority": "LAB_APPLIANCE_BUNDLE_ACQUISITION_LOCK_V8",
  "derivedAuthorities": [
    "digest-pinned-core-workload-images"
  ],
  "inputPack": {
    "buildSpecPath": "build-spec.json",
    "format": "zip",
    "parts": [
      {
        "index": 0,
        "sha256": "660137e664cce4f3862c134247fc919bbcd555b352b1c22632526d9f6be1c2c1",
        "sizeBytes": 1610612736,
        "urls": [
          "https://github.com/rezabehroozi/4so-platform-factory/releases/download/appliance-dist-v0.0.363-33fa8a9ae6ce94f2/appliance-input-pack.zip.part0000.sha256-660137e664cce4f3862c134247fc919bbcd555b352b1c22632526d9f6be1c2c1"
        ]
      },
      {
        "index": 1,
        "sha256": "4fce56f5c40e636a29fb0cbdc6c41d22059eeba64517e374c9ed339bc470f40f",
        "sizeBytes": 1568484371,
        "urls": [
          "https://github.com/rezabehroozi/4so-platform-factory/releases/download/appliance-dist-v0.0.363-33fa8a9ae6ce94f2/appliance-input-pack.zip.part0001.sha256-4fce56f5c40e636a29fb0cbdc6c41d22059eeba64517e374c9ed339bc470f40f"
        ]
      }
    ],
    "sha256": "33fa8a9ae6ce94f2f517a500858c2dc910b3c382cbdb0ab88ea41f2e56a63fc6",
    "sizeBytes": 3179097107,
    "stagingDirectory": "staging"
  },
  "missingAuthorities": [],
  "partialAuthorities": [],
  "releaseVersion": "0.0.363",
  "resolvedAuthorities": [
    {
      "artifacts": [
        {
          "name": "ha-install.yaml",
          "sha256": "65d9d4ff520ddb40bad2c39b1f44188ceecfe96b5dd29c8ead569b52d6c6b8c6",
          "sizeBytes": 1969264,
          "stagingPath": "manifests/argocd-ha-install.yaml",
          "urls": [
            "https://raw.githubusercontent.com/argoproj/argo-cd/e95e1be88a2da6c06bff5c2fe1791e4d233ed810/manifests/ha/install.yaml"
          ]
        }
      ],
      "id": "argocd-ha-install-manifest",
      "kind": "kubernetes-manifest",
      "provider": "argocd",
      "scope": "management-plane-gitops-reconciler-production-ha",
      "version": "v3.5.0"
    },
    {
      "artifacts": [
        {
          "name": "install.yaml",
          "sha256": "a32bf36a437071a1f563ebf9e81c8a39fba9057c17db7d5d041afb7b6e3f4afe",
          "sizeBytes": 1917766,
          "stagingPath": "manifests/argocd-install.yaml",
          "urls": [
            "https://raw.githubusercontent.com/argoproj/argo-cd/e95e1be88a2da6c06bff5c2fe1791e4d233ed810/manifests/install.yaml"
          ]
        }
      ],
      "id": "argocd-install-manifest",
      "kind": "kubernetes-manifest",
      "provider": "argocd",
      "scope": "management-plane-gitops-reconciler",
      "version": "v3.5.0"
    },
    {
      "artifacts": [
        {
          "name": "cnpg-1.30.0.yaml",
          "sha256": "f8bede43fe4ee0d478c2355b204a36876b2ae4faac60f2a9452280b293da3b88",
          "sizeBytes": 1262410,
          "stagingPath": "manifests/cloudnative-pg-install.yaml",
          "urls": [
            "https://github.com/cloudnative-pg/cloudnative-pg/releases/download/v1.30.0/cnpg-1.30.0.yaml"
          ]
        }
      ],
      "id": "cloudnative-pg-install-manifest",
      "kind": "kubernetes-manifest",
      "provider": "cloudnative-pg",
      "scope": "management-plane-postgresql-operator",
      "version": "v1.30.0"
    },
    {
      "artifacts": [
        {
          "name": "platform-workloads.oci.tar",
          "parts": [
            {
              "index": 0,
              "sha256": "959f5cbf38636318b67c8521ded10861061df92b98537281bb6b8662e3526b87",
              "sizeBytes": 1610612736,
              "urls": [
                "https://github.com/rezabehroozi/4so-platform-factory/releases/download/appliance-dist-v0.0.363-33fa8a9ae6ce94f2/platform-workloads.oci.tar.part0000.sha256-959f5cbf38636318b67c8521ded10861061df92b98537281bb6b8662e3526b87"
              ]
            },
            {
              "index": 1,
              "sha256": "c498f77776573f1fd9887ad2f017a2cffaea716b304ad1d3481361f3dc48696f",
              "sizeBytes": 696583168,
              "urls": [
                "https://github.com/rezabehroozi/4so-platform-factory/releases/download/appliance-dist-v0.0.363-33fa8a9ae6ce94f2/platform-workloads.oci.tar.part0001.sha256-c498f77776573f1fd9887ad2f017a2cffaea716b304ad1d3481361f3dc48696f"
              ]
            }
          ],
          "sha256": "33122daf7b73bd6c9929dc5aa0a6d1ea8066f3a3b6486d0a753f0bf09a3f06dc",
          "sizeBytes": 2307195904,
          "stagingPath": "workloads/platform-workloads.oci.tar"
        }
      ],
      "id": "management-workload-oci-archive",
      "kind": "oci-archive",
      "provider": "4so",
      "scope": "management-plane-workload-images-offline-distribution",
      "version": "0.0.363"
    },
    {
      "artifacts": [
        {
          "name": "longhorn.yaml",
          "sha256": "41648963af867ac1d0c85755fb53cf61cacd57c9bb22e1942e3fb0439eeb04fd",
          "sizeBytes": 207054,
          "stagingPath": "manifests/replicated-storage-install.yaml",
          "urls": [
            "https://github.com/longhorn/longhorn/releases/download/v1.12.1/longhorn.yaml"
          ]
        }
      ],
      "id": "replicated-storage-install-manifest",
      "kind": "kubernetes-manifest",
      "provider": "longhorn",
      "scope": "management-plane-rke2-production-ha-only",
      "version": "v1.12.1"
    },
    {
      "artifacts": [
        {
          "name": "rke2.linux-amd64.tar.gz",
          "sha256": "a4501349a4c9affeef8b7ec6a206720afe7e901486581b21e8a7d3a865a45ada",
          "sizeBytes": 40695069,
          "stagingPath": "rke2/rke2.linux-amd64.tar.gz",
          "urls": [
            "https://github.com/rancher/rke2/releases/download/v1.34.10%2Brke2r1/rke2.linux-amd64.tar.gz"
          ]
        },
        {
          "name": "rke2-images.linux-amd64.tar.zst",
          "sha256": "03af45a72d1bd246f0474c86ba5bc39531eda0d3446ff4de82bdd298d4f6ef6b",
          "sizeBytes": 825815300,
          "stagingPath": "rke2/rke2-images.linux-amd64.tar.zst",
          "urls": [
            "https://github.com/rancher/rke2/releases/download/v1.34.10%2Brke2r1/rke2-images.linux-amd64.tar.zst"
          ]
        },
        {
          "name": "sha256sum-amd64.txt",
          "sha256": "bdd5aadc9ff4c2cf48316ddea4763fcc5a4333dab1196caebc1704c1b7f80e15",
          "sizeBytes": 3540,
          "stagingPath": "rke2/sha256sum-amd64.txt",
          "urls": [
            "https://github.com/rancher/rke2/releases/download/v1.34.10%2Brke2r1/sha256sum-amd64.txt"
          ]
        },
        {
          "name": "install.sh",
          "sha256": "2d24db2184dd6b1a5e281fa45cc9a8234c889394721746f89b5fe953fdaaf40a",
          "sizeBytes": 25288,
          "stagingPath": "rke2/install.sh",
          "urls": [
            "https://raw.githubusercontent.com/rancher/rke2/d419f09226d50a4777d348e5c53ea1bce3849b77/install.sh"
          ]
        }
      ],
      "id": "rke2-installer-and-offline-artifacts",
      "kind": "release-artifact-set",
      "provider": "rke2",
      "scope": "management-plane-rke2-production-ha-only",
      "version": "v1.34.10+rke2r1"
    }
  ],
  "schemaVersion": 8,
  "status": "ready"
}
